id;name;type;foundation_date;architect;status;address;short_description;dedications;lat;lon
17900;Часовня Любови Рязанской на Скорбященском кладбище;часовня;1992;1992: Камышанов К. Е.;действ.;Рязанская обл., г. Рязань, Колхозный пр., 1;Часовня над могилой блаженной Любови Рязанской, с 1920-х почитавшейся горожанами и канонизированной в 1998. Построена в 1992. Небольшая кирпичная одноглавая постройка с трифолийными завершениями фасадов.;Любови Рязанской;54.612333;39.749548
22446;Часовня Любови Рязанской при Благовещенской церкви;часовня;2013;нет данных;действ.;Рязанская обл., г. Рязань, ул. Затинная, 58;Кирпичная часовня у Благовещенской церкви, рядом с местом дома, в котором проживала блаж. Любовь Рязанская. Сооружена в 2013-2014. Четверик, завершенный низким восьмериком с шатром, с притвором.;Любови Рязанской;54.634124;39.761018
17901;Часовня Николая Чудотворца (?) на Скорбященском кладбище;часовня;1885;нет данных;сохр.;Рязанская обл., г. Рязань, Колхозный пр., 1;Часовня-усыпальница над могилой помещика Н. Казначеева, сооруженная в 1885 его братом Т. Казначеевым. Пятиглавая кирпичная кубическая постройка. Заперта, поддерживается в порядке.;Николая Чудотворца;54.611470;39.748282
18774;Церковь Преображения Господня в Бабино-Булыгино;церковь;не позже 1626;нет данных;действ.;Рязанская обл., Касимовский р-н, с. Бабино-Булыгино;Кирпичная церковь, построенная в 1740, предположительно касимовским комиссаром Ф. С. Скорняковым. Двусветный четверик, завершенный малым восьмериком, с пятигранным алтарем, трапезной с северным Рождество-Богородицким приделом и невысокой колокольней, с декором в духе провинциального барокко. Главный престол первоначально Воскресенский, в 1788 переосвящен в Преображенский. Не закрывалась.;"Преображения Господня; Воскресения Христова; Рождества Пресвятой Богородицы";54.926500;41.333200
25590;Церковь Спиридона, епископа Тримифунтского, в Баграмово;церковь;2010;строится: Осышный С. В.;действ.;Рязанская обл., Рыбновский р-н, д. Баграмово;Каменный одноглавый однопрестольный храм в стиле русского узорочья сер. XVII в., с одноглавым пристроем с северной стороны, в котором расположена пономарка. Заложен 28 июня 2013 по проекту арх. Осышного С. В. Освящен 22 авг. 2020.;Спиридона, епископа Тримифунтского;54.723197;39.454762
25589;Церковь Спиридона, епископа Тримифунтского, в Баграмово (временная);церковь;2010;нет данных;действ.;Рязанская обл., Рыбновский р-н, д. Баграмово;Временный храм из быстровозводимых конструкций, заложенный 6 сент. 2010, и освященный в 2011.;Спиридона, епископа Тримифунтского;54.723479;39.454939
17836;Церковь Троицы Живоначальной в Байдиках;церковь;1690;нет данных;сохр.;Рязанская обл., Захаровский р-н, с. Байдики;Кирпичная церковь, в своей архитектуре сочетающая объёмные формы эпохи классицизма с эклектичным декором. Построена в 1877. Четверик, завершённый ротондой, с полукруглым алтарём, трапезной и колокольней. Придел Рождество-Богородицкий. Закрыта в 1940, колокольня сломана. Пустует.;"Троицы Живоначальной; Рождества Пресвятой Богородицы";54.345140;39.403811
10453;Церковь Воздвижения Честного Креста Господня в Балушевых-Починках;церковь;не позже 1-й трети XVII в.;нет данных;действ.;Рязанская обл., Касимовский р-н, с. Балушевы-Починки;Кирпичная церковь, построенная в 1869 в духе эклектики. Здание типа восьмерик на четверике с небольшой двухпридельной трапезной и высокой четырёхъярусной колокольней. Приделы Знаменский и Никольский. В настоящее время пустует, идет активное восстановление. Богослужения совершаются по выходным дням в освященном 20 июля 2019 Никольском приделе.;"Воздвижения Честного Креста Господня; Николая Чудотворца; Иконы Божией Матери Знамение";54.768300;41.621000
18832;Церковь Троицы Живоначальной в Барснево (новая);церковь;сер. 1970-х;нет данных;действ.;Рязанская обл., Клепиковский р-н, с. Барснево;Храм, устроенный в сер. 1970-х, после гибели в пожаре старой церкви, в деревянной церковной сторожке. Прямоугольная постройка, обшитая тесом. Внешне выделена главками.;Троицы Живоначальной;55.044352;40.552425
26799;Церковь Троицы Живоначальной в Бахмачеево;церковь;1752;нет данных;действ.;Рязанская обл., Рязанский р-н, с. Бахмачеево;Кирпичная однопрестольная церковь построена к 1888 в стиле эклектики тщанием священника Александра Соллерса и прихожан вместо деревянной, возведённой в 1838. К завершённому низким куполом и поставленным над ним световым барабаном с главой прямоугольному двусветному основному объёму примыкают апсида и трапезная с трёхъярусной колокольней. Закрыта в 1939 с целью использования под школу, вновь действовала в 1946-1964, затем обращена в клуб, позднее в склад, утратила главы. Передана епархии в 2003, освящена малым чином 9 мар. 2012. Ремонтируется.;Троицы Живоначальной;54.611172;39.387516
25592;Церковь Покрова Пресвятой Богородицы в Безлычном;церковь;Нач. 2010-х;нет данных;действ.;Рязанская обл., Захаровский р-н, д. Безлычное;Каменный одноглавый однопрестольный храм, устроенный в нач. 2010-х в приспособленнном здании.;Покрова Пресвятой Богородицы;54.438130;39.462146
18775;Часовня Матроны Анемнясевской в Бельково;часовня;2000-е;нет данных;действ.;Рязанская обл., Касимовский р-н, д. Бельково;Кирпичный часовенный столб.;Матроны Анемнясевской;55.011700;41.148432
19221;Церковь Благовещения Пресвятой Богородицы в Бельском;церковь;;нет данных;сохр.;Рязанская обл., Спасский р-н, с. Бельское;Деревянная церковь, обшитая тесом, с высокой трехъярусной колокольней, завершенной каркасным шатром. Построена в дальней деревне кидусалинского прихода, освящена в 1896. Закрыта не позже 1930-х, позже сам храм сломан. Уцелела только колокольня, сейчас находящаяся в аварийном состоянии.;"Благовещения Пресвятой Богородицы; Александра Невского";54.736100;40.354500
23984;Церковь Покрова Пресвятой Богородицы в Береговой Погореловке;церковь;сер. XVII в.;нет данных;сохр.;Рязанская обл., Пронский р-н, с. Береговая Погореловка;Кирпичная церковь, построенная в 1744 капитаном флота помещиком И. И. Бурцевым. Здание типа восьмерик на четверике с восьмериком, по высоте превосходящем четверик, с небольшой трапезной, в которой помещался Пятницкий придел, и колокольней. Закрыта не позже 1930-х, к 1990-м заброшена. С 2000-х ремонтируется.;"Покрова Пресвятой Богородицы; Параскевы (Пятницы)";54.090477;39.712429
24027;Церковь Успения Пресвятой Богородицы в Берёзово;церковь;1868;нет данных;действ.;Рязанская обл., Михайловский р-н, с. Березово;Церковь в селе, выселившемся из Печерников в 1860 и выделенном в отдельный приход в 1868. Кирпичный храм выстроен в 1907, Пятницкий придел освящен в 1912. Здание сооружено по образцовому проекту - четырехстолпный односветный объем с трехъярусной колокольней. Закрыта не позже 1930-х. В нач. 1990-х возвращена верующим, отремонтирована.;"Успения Пресвятой Богородицы; Параскевы (Пятницы)";54.091840;39.287122
10468;Церковь Иконы Божией Матери Казанская в Бетино;церковь;не позже сер. XVII века;нет данных;действ.;Рязанская обл., Касимовский р-н, с. Бетино;Каменная четырёхпрестольная церковь, построена вместо прежней деревянной Казанской церкви, пришедшей в ветхость. Приделы: холодный Никитский, тёплые Никольский и Троицкий. В советское время закрыта, разорена. Ныне восстановлена ротонда с главой, начаты регулярные богослужения.;"Иконы Божией Матери Казанская; Николая Чудотворца; Троицы Живоначальной; Никиты Великомученика";54.787300;41.480300
24208;Церковь Иконы Божией Матери Корсунская в Богородицком;церковь;;нет данных;действ.;Рязанская обл., Ухоловский р-н, с. Богородицкое;Кирпичная однопрестольная церковь, построенная в 1800 помещиком прапорщиком М. Н. Кормилицыным. Однокупольный четверик с полукруглым алтарем, небольшой трапезной и колокольней. Закрыта не позже 1930-х, венчания и колокольня сломаны, к 1990-м заброшена. Восстановление нач алось 22 окт. 2009, а 22 окт. 2016 храм был освящен малым чином.;Иконы Божией Матери Корсунская;53.550600;40.575410
7158;Церковь Иоанна Богослова в Богослово;церковь;рубеж XIX-XX вв.;нет данных;сохр.;Рязанская обл., Скопинский р-н, с. Богослово;Кирпичная церковь выстроена на средства прихожан в 1901 при бывшей помещичьей усадьбе Варыпаевых, принадлежавшей на тот период владельцу Богословского №2 винокуренного завода Н. П. Воронину. Закрыта в кон. 19З0-х, тогда же была сломана колокольня. В 1950-1960-х использовалась как сельский клуб. В настоящее время заброшена и разрушается.;Иоанна Богослова;53.902000;39.059000
8395;Церковь Богоявления Господня на Богоявленском Погосте;церковь;;нет данных;сохр.;Рязанская обл., Ермишинский р-н, ур. Богоявление (1,5 км ЮВ с. Большое Ляхово);;"Богоявления Господня; Покрова Пресвятой Богородицы; Николая Чудотворца";54.640521;42.136469
26539;Церковь Новомучеников и Исповедников Российских на Богоявленском Погосте;церковь;2018;нет данных;действ.;Рязанская обл., Ермишинский р-н, ур. Богоявление (1,5 км ЮВ с. Большое Ляхово);Деревянная одноглавая однопрестольная церковь, заложенная 24 июня 2018 на подворье Кадомского Богородице-Милостивского монастыря. Освящена 25 июля 2020 великим чином.;Новомучеников и Исповедников Российских;54.639980;42.133998
18833;Церковь Троицы Живоначальной в Болони;церковь;кон. 1990-х;нет данных;действ.;Рязанская обл., Клепиковский р-н, пос. Болонь, ул. Центральная, 11;Церковь устроена в помещении, выделенном в двухэтажном кирпичном здании 2-й пол. ХХ в., на коньке кровли которого поставлена небольшая главка.;Троицы Живоначальной;55.052613;40.085163
23805;Церковь Покрова Пресвятой Богородицы в Большой Алешне;церковь;1673;нет данных;действ.;Рязанская обл., Ряжский р-н, с. Большая Алешня;Кирпичная церковь стиля классицизма, построенная в 1805-1806 княгиней Е. А. Кропоткиной. Четверик, увенчанный крупной ротондой, с боковыми портиками, трапезной, в которой был Никольский придел, и колокольней. Главный престол первоначально Страстной Богоматери. Закрыта в 1930, трапезная и колокольня сломаны. Возвращена верующим в 1997, отремонтирована, освящена как Покровская.;"Покрова Пресвятой Богородицы; Иконы Божией Матери Страстная; Николая Чудотворца";53.639880;40.131977
26540;Часовня Новомучеников и Исповедников Российских в Большом Агишево;часовня;2012;нет данных;действ.;Рязанская обл., Сасовский р-н, с. Большое Алешино, ул. Центральная;Каменная одноглавая часовня - четверик под кровлей колпаком, заложенная 14 июля 2012. Приписана к Троицкому храму г. Шацка.;Рождества Христова;54.125328;41.732114
15626;Церковь Иконы Божией Матери Тихвинская в Большом Жоково;церковь;;нет данных;действ.;Рязанская обл., Рыбновский р-н, с. Большое Жоково;Кирпичная одноглавая однопрестольная церковь с ярусной колокольней. Построена как кладбищенская, приписная к Спасской церкви на Кобыльском Погосте. Очень низкий четверик, равный по высоте трапезной, перекрытый низким четырехгранным шатром. Трёхъярусная колокольня пристроена в 1878. В годы советской власти закрыта, руинирована. В настоящее время возвращена верующим, отремонтирована. В 2003 зарегистрировано Тихвинское подворье Покровского женского монастыря.;Иконы Божией Матери Тихвинская;54.572631;38.957391
6825;Церковь Иконы Божией Матери Казанская в Большом Самарино;церковь;1829;нет данных;действ.;Рязанская обл., Ряжский р-н, с. Большое Самарино;Выстроена в 1830-1835 тщанием Н. И. Самариной. Кирпичная однокупольная классицистическая церковь с широкой трапезной и квадратной колокольней. Приделы Иоанна Богослова и вмц. Варвары. В советское время закрывалась и использовалась как колхозный склад. Возвращена верующим в аварийном состоянии, ремонтируется.;"Иконы Божией Матери Казанская; Варвары Великомученицы; Иоанна Богослова";53.590067;40.041335
23982;Церковь Константина и Елены в Большом Селе;церковь;не позже XVI в.;нет данных;сохр.;Рязанская обл., Пронский р-н, с. Большое Село;Кирпичный храм, построенный в 1712 стольником И. С. Бурцевым. Здание типа восьмерик на четверике с богатым декором в нарышкинском стиле. Трапезная с приделами Михаило-Архангельский и Димитрия Ростовского (устроен в 1784) и трехъярусной колокольней сооружена вновь в 1784. Закрыта не позже 1930-х. Заброшена.;"Константина и Елены; Димитрия, митрополита Ростовского; Михаила Архангела";54.141048;39.733881
4238;Церковь Рождества Христова в Борце;церковь;;нет данных;действ.;Рязанская обл., Сараевский р-н, с. Борец;;Рождества Христова;53.801100;41.139000
19089;Церковь Введения Пресвятой Богородицы во Храм в Борисково;церковь;1899;нет данных;действ.;Рязанская обл., Рязанский р-н, с. Борисково;Деревянная церковь, обшитая тесом, с декором в стиле классицизма. Построена в 1899 в дальней деревне уржинского прихода. Здание типа восьмерик на четверике с пятигранным алтарем и протяженной трапезной, в которой был придел Иоакима и Анны. Закрыта в 1938. В сер. 1940-х возвращена верующим, более не закрывалась.;"Введения Пресвятой Богородицы во Храм; Иоакима и Анны";54.774300;40.208900
10512;Церковь Спаса Нерукотворного Образа в Борках;церковь;не позже 2-й пол. XVII в.;нет данных;действ.;Рязанская обл., Шиловский р-н, с. Борки;Кирпичная церковь в стиле классицизма, сооружённая в 1805-1811 на средства В. Т. Мельгуновой. Однокупольный храм с трапезной и колокольней. Трапезная с Успенским и Никольским приделами расширена в нач. 1870-х. Практически не закрывалась.;"Спаса Нерукотворного Образа; Николая Чудотворца; Успения Пресвятой Богородицы";54.620200;41.155400
9308;Церковь Рождества Христова в Букрино;церковь;не позже 1-й пол. XVII в.;2000-е: Тутунов А. С. – реставрация;действ.;Рязанская обл., Рязанский р-н, с. Букрино;;"Рождества Христова; Михаила Архангела; Троицы Живоначальной";54.343400;39.895800
18835;Церковь Иконы Божией Матери Казанская в Бусаево (новая);церковь;не позже сер. XIX в.;нет данных;действ.;Рязанская обл., Клепиковский р-н, с. Бусаево;Зимняя церковь прихода, вероятно, построенная в XIX в. и освящённая как Пятницкая. Закрыта в 1930-х, занята под склад, во 2-й пол. ХХ в. капитально перестроена под клуб. В 2002 возвращена верующим, освящена как Казанская. Литургии возобновлены в 2013. Представляет собой одноэтажное деревянное здание, обшитое вагонкой и увенчанное главкой.;"Иконы Божией Матери Казанская; Параскевы (Пятницы)";55.084070;40.399266
18834;Церковь Иконы Божией Матери Казанская в Бусаево (старая);церковь;не позже сер. XIX в.;нет данных;сохр.;Рязанская обл., Клепиковский р-н, с. Бусаево;Деревянная летняя церковь прихода с Аннинским приделом, построенная в 1846. Многоярусная кирпичная колокольня в псевдорусском стиле построена в нач. ХХ в. Закрыта в 1930-х, перестроена в школу, сгорела в 1985. Колокольня уцелела.;"Иконы Божией Матери Казанская; Анны Пророчицы";55.084328;40.399089
