id;name;type;foundation_date;architect;status;address;short_description;dedications;lat;lon
12034;Церковь Воскресения Словущего на Воскресенском Судском погосте;церковь;не позже 2-й пол. XVII в.;нет данных;сохр.;Вологодская обл., Бабаевский р-н, ур. Поповская (1 км В д. Ширяевская);Кирпичная церковь, выстроенная в 1841 в формах, переходных от позднего классицизма к русско-византийскому стилю. Четырёхстолпный однокупольный храм с шатровой колокольней. Приделы Харалампиевский и Успенский. Закрыта не позже 1930-х. В настоящее время заброшена, в тяжёлом состоянии.;"Воскресения Словущего; Харалампия, епископа Магнезийского; Успения Пресвятой Богородицы";59.822656;36.060133
22773;Церковь Троицы Живоначальной в Поповском;церковь;не позже кон. XVIII в.;нет данных;сохр.;Вологодская обл., Сокольский р-н, д. Поповское;Каменная, одноэтажная, в одной связи с колокольней церковь. Построена в 1831 рядом с древней деревянной, упраздненной за ветхостью и позже разобранной. Двухсветный ротондальный объём холодного храма, перекрытый куполом с главкой, с примыкающей трапезной и трёхъярусной колокольней. Трёхпрестольная: Троицы Живоначальной — главный, в трапезной — Преображения Господня (правый),Алексия, митрополита Московского (левый). Закрыта в 1937, использовалась под зерносклад. В 1980-х сильно пострадала от пожара. В начале 2000-х была предпринята попытка восстановления храма — купол покрыт рубероидом, здание обнесено лесами, но из-за недостаточности средств работы прекращены.;"Троицы Живоначальной; Алексия, митрополита Московского; Преображения Господня";59.418889;40.465299
24047;Часовня Спаса Нерукотворного Образа в Потеряево;часовня;2001;нет данных;действ.;Вологодская обл., Шекснинский р-н, д. Потеряево;Деревянная шатровая часовня простой архитектуры, восьмерик на четверике. Освящена 31 августа 2002.;Спаса Нерукотворного Образа;59.137593;38.419427
22053;Церковь Илии Пророка на Поцком погосте;церковь;не позже XVIII в.;нет данных;сохр.;Вологодская обл., Тарногский р-н, с. Поцкий Погост;Кирпичная теплая церковь в формах классицизма с элементами эклектики в декоре, построенная в 1804-1818. Двусветный четверик, перекрытый купольной кровлей, с небольшой трапезной и трехъярусной колокольней под шпилем, сооруженной в 3-й четв. XIX в. Закрыта не позже 1930-х, пустует.;Илии Пророка;60.461392;43.032990
11337;Церковь Иконы Божией Матери Владимирская в Поченге;церковь;не позже XVII в.;нет данных;сохр.;Вологодская обл., Вологодский р-н, д. Поченга;Кирпичная церковь, построенная в 1780. Двусветный четверик с трапезной и колокольней. Приделы Воскресенский и Симеоно-Аннинский. Закрыта не позже 1930-х, венчания сломаны. В настоящее время заброшена, своды обрушились.;"Иконы Божией Матери Владимирская; Симеона и Анны; Воскресения Христова";59.275631;39.480427
12091;Церковь Воскресения Христова Толшемская в Предтече;церковь;;нет данных;сохр.;Вологодская обл., Тотемский р-н., д. Предтеча;Однопрестольная каменная церковь, выстроенная в 1787 в формах барокко, ярусная колокольня в связи с трапезной. В советское время закрыта, использовалась как складское помещение. Колокольня завершалась шпилем, основной храм - луковичной главкой на небольшом куполе. После пожара в 1990-х обрушились завершения храма и колокольни.;Воскресения Христова;59.428403;42.708406
12090;Церковь Рождества Иоанна Предтечи Толшемская в Предтече;церковь;;нет данных;сохр.;Вологодская обл., Тотемский р-н., д. Предтеча;Однопрестольная одноглавая деревянная церковь постройки 1776. Основной объём - восьмерик на высоком четверике с пятигранной апсидой, на подклете, с закрытым гульбищем, охватывающим с трёх сторон трапезную. В советское время закрыта, использовалась как складское помещение. Основной объём храма с апсидой обрушились в 2007.;Рождества Иоанна Предтечи;59.428054;42.708235
21783;;;;;;;;;;
4421;Церковь Преображения Господня на Спас-Шужгорском погосте;церковь;XVI в.;нет данных;сохр.;Вологодская обл., Белозерский р-н, ур. Пугорка;Каменная церковь, прежде храм Преображенского Шужгорского монастыря, основанного в XVI в. прп. Даниилом Шужгорским. После упразднения монастыря в 1764 обращена в приходскую церковь. Имелись два придела - Даниила Столпника и Даниила Шужгорского. В советское время закрыта, сильно руинирована.;"Преображения Господня; Даниила Шужгорского; Даниила Столпника";59.654335;37.323299
21735;Часовня в Пуронге;часовня;;нет данных;сохр.;Вологодская обл., Сямженский р-н, д. Пуронга;Деревянная ярусная часовня (посвящение неизвестно). Основной объем восьмерика нес еще два восьмерика, сужающихся на каждом ярусе, но все же широких: второй имел два окна второго света (на юг и на север), верхний был накрыт невысоким граненым куполом под железом. Каким было завершение – неизвестно. В настоящее время заброшена и практически полностью разрушена.;;60.145968;40.916653
12721;Нило-Сорская мужская пустынь;монастырь;1480-е;нет данных;действ.;Вологодская обл., Кирилловский р-н, м. Пустынь;Мужской монастырь, основанный в 1480-х как скит иноком Кирилло-Белозерского монастыря, прп. Нилом Сорским, знаменитым подвижником и духовным писателем кон. XV в. В XV-XVI вв. был известен строгим общежительным уставом. С 1681 был приписан к Кириллову монастырю, к кон. XVIII в. пришел в упадок. Восстановлен как самостоятельный и получил статус монастыря в 1850, в сер. XIX в. сооружены кирпичные храмы, ограда с башнями и келейные корпуса. В 1919 преобразован в общину, окончательно закрыт в 1927. С 1920-х занят колонией, домом инвалидов, в настоящее время (с 1961) - психоневрологическим диспансером. В 2018 диспансер освободил все здания пустыни, началось возрождение монастыря. 30 мая 2019 решением Священного Синода монастырь вновь открыт.;;59.983688;38.292300
12722;Собор Иконы Божией Матери Тихвинская в Нило-Сорской пустыни;церковь;кон. XV в.;нет данных;сохр.;Вологодская обл., Кирилловский р-н, м. Пустынь;Кирпичный собор в стиле позднего классицизма, построенный на месте деревянных Сретенской и Предтеченской церквей в 1841-1854. Односветный четырехстолпный четверик, увенчанный крупным центральным куполом и четырьмя малыми куполами, с теплой трапезной и трехъярусной колокольней под шпилем. Боковые приделы прп. Нила и Петропавловкий, в трапезной Сретенский и Никольский приделы. Закрыт в 1920-х, венчания сломаны. Занят столовой.;"Иконы Божией Матери Тихвинская; Николая Чудотворца; Нила Сорского; Сретения Господня; Петра и Павла";59.983522;38.292160
12723;Церковь Покрова Пресвятой Богородицы в Нило-Сорской пустыни;церковь;1862;нет данных;сохр.;Вологодская обл., Кирилловский р-н, м. Пустынь;Надвратная церковь над Святыми воротами в восточной стене монастыря, построенная в 1862-1866. Пятиглавый четверик эклектичной архитектуры. Закрыта не позже 1920-х. В 1996 пожаром разрушено венчание, восстановленное в кон. 2000-х.;Покрова Пресвятой Богородицы;59.983559;38.293233
10907;Церковь Рождества Пресвятой Богородицы на Пучининском Погосте;церковь;;нет данных;сохр.;Вологодская обл., Вологодский р-н, ур. Пучнинский погост (1 км. на Ю-З от д. Пучинино);Каменная трехпрестольная церковь с Введенским и Скорбященским приделами. Была приписана к Никольской церкви в Лумбе. В советское время закрыта, ныне заброшена, разрушается.;"Рождества Пресвятой Богородицы; Иконы Божией Матери Всех Скорбящих Радость; Введения Пресвятой Богородицы во Храм";59.217892;39.243400
6790;Часовня Покрова Пресвятой Богородицы в Пяжелке;часовня;2000-е;нет данных;действ.;Вологодская обл., Бабаевский р-н, д. Пяжелка;;Покрова Пресвятой Богородицы;60.150861;35.745714
17330;Церковь Параскевы (Пятницы) Великомученицы в Погорелово;церковь;не позже 1-й пол. XVII в.;нет данных;сохр.;Вологодская обл., Великоустюгский р-н, ур. Пятницкий погост;Кирпичная двухпрестольная церковь с Никольским приделом, построена иждивением купца И. Курочкина и прихожан вместо двух деревянных, пришедших в ветхость. Представляет собой одноглавый двухсветный четверик с трапезной и колокольней с восьмигранным ярусом звона. В советское время закрыта, разорена, ныне пустует.;"Параскевы (Пятницы) Великомученицы; Николая Чудотворца";60.895179;46.348497
18054;Часовня на Пятницком погосте;часовня;;нет данных;действ.;Вологодская обл., Великоустюгский р-н, ур. Пятницкий погост;Небольшая деревянная часовня с клинчатой кровлей над могилой старца Максима Погореловского (Югова), построена вместо прежней, сгоревшей в 2006. Прежняя часовня была квадратной в плане, с четырёхскатной кровлей.;;60.895030;46.348802
11255;Церковь Богоявления Господня в Раменье;церковь;;нет данных;действ.;Вологодская обл., Грязовецкий р-н, д. Раменье;Кирпичная церковь, построенная в 1812. Хороший образец классицизма, однокупольный храм с четырёхлепестковым планом, с трапезной и невысокой колокольней. Приделы Предтеченский и Никольский. Не закрывалась.;"Богоявления Господня; Николая Чудотворца; Иоанна Предтечи";;
22771;Часовня Иконы Божией Матери Владимирская в Родюкино;часовня;1871;нет данных;действ.;Вологодская обл., Сокольский р-н, д. Родюкино;Кирпичная восьмигранная шатровая часовня, возведённая в 1894 вместо деревянной, построенной в 1871. Была приписана к приходу Воскресенской Боровецкой церкви. Закрыта в 1930-х, в разное время в помещении размещались: контора, склад, магазин. В начале 2000-х начаты ремонтно-восстановительные работы, в 2009 часовня освящена.;Иконы Божией Матери Владимирская;59.434049;40.045353
15113;Церковь Введения Пресвятой Богородицы во Храм на Ромашевском погосте;церковь;;нет данных;сохр.;Вологодская обл., Тарногский р-н, с. Ромашевский Погост;Обширная деревянная церковь, обшитая тесом, построенная в 1767. Четверик с пятигранной апсидой и трапезной, надстроенный вторым ярусом из четверика с апсидой, увенчанной небольшой бочкой. Основной объем здания был увенчан шатром. Служила теплым храмом прихода. Второй престол Макария Унженского помещался на втором ярусе над основным объемом. Закрыта не позже 1930-х, венчания сломаны. Использовалась как клуб, к 1990-м заброшена, в аварийном состоянии. Ремонтно-консервационные работы начаты в 2011.;"Введения Пресвятой Богородицы во Храм; Макария Желтоводского";60.498312;43.346091
30349;Церковь Воскресения Христова в Рукино (новая);церковь;;2016-2021: Фомичев А. В.;действ.;Вологодская обл., Кирилловский р-н, с. Рукино;;Воскресения Христова;59.860828;38.958384
12079;Церковь Воскресения Христова в Рукино (старая);церковь;не позже XVIII в.;нет данных;сохр.;Вологодская обл., Кирилловский р-н, с. Рукино;Кирпичная церковь, построенная в 1822. Здание типа восьмерик на четверике с трапезной и многоярусной колокольней, с ордерным декором. В трапезной были Ильинский и Сергиевский приделы. Закрыта в кон. 1930-х, в настоящее время пустует, своды трапезной рухнули.;"Воскресения Христова; Сергия Радонежского; Илии Пророка";59.860751;38.958459
21698;Церковь Покрова Пресвятой Богородицы в Сазоново;церковь;;нет данных;действ.;Вологодская обл., Чагодощенский р-н, пос. Сазоново;Кирпичная, в одной связи с колокольней, трехпрестольная церковь. Главный престол Покрова Пресвятой Богородицы, тёплые приделы Архангела Михаила и Николая Чудотворца. Начата строительством в 1785, завершена в 1805. Закрыта в 1933 году, завершения и колокольня снесены, здание использовалось под склад, клуб, контору. С 1992 начато восстановление, поставлена звонница, достроена алтарная апсида.;"Покрова Пресвятой Богородицы; Николая Чудотворца; Михаила Архангела";59.078770;35.237849
3782;Церковь Иконы Божией Матери Тихвинская в Саминском Погосте;церковь;не позже 1-й пол. XVII в.;нет данных;сохр.;Вологодская обл., Вытегорский р-н, с. Саминский Погост;Деревянная пятиглавая церковь в русско-византийском стиле. Дошедшее до нас здание было построено на фундаменте древней деревянной церкви Флора и Лавра (1656) В настоящее время сильно разрушена.;Иконы Божией Матери Тихвинская;61.347794;36.599365
3781;Церковь Илии Пророка в Саминском Погосте;церковь;;нет данных;сохр.;Вологодская обл., Вытегорский р-н, с. Саминский Погост;Деревянная шатровая церковь прионежского типа с обширной трапезной и колокольней. Основной объём - восьмерик на четверике, покрытый восьмигранным шатром. Позже к трапезной была пристроена колокольня, представлявшая собой четверик в основании с двумя ярусами небольших восьмериков и ярусом звона. В советское время закрыта, в ней располагался клуб. В настоящее время начата реставрация, в ходе которой была разобрана пристроенная колокольня. На Ильин день (2 авг.) в церкви совершаются молебны.;Илии Пророка;61.347477;36.599208
11113;Церковь Происхождения Честных Древ Креста Господня на Спасо-Угольском погосте;церковь;;нет данных;сохр.;Вологодская обл., Шекснинский р-н, д. Самсоница (Угольское с/п);Кирпичная зимняя церковь прихода, сооружённая, судя по архитектуре, в XVIII в. Приделы Ильинский, Михаило-Архангельский и Боголюбский. До настоящего времени уцелел основной объём типа восьмерик на четверике с разрушенным куполом.;"Происхождения Честных Древ Креста Господня; Иконы Божией Матери Боголюбская; Михаила Архангела; Илии Пророка";;
10796;Церковь Введения Пресвятой Богородицы во Храм в Санниково;церковь;;нет данных;сохр.;Вологодская обл., Череповецкий р-н, д. Санниково;Кирпичная трёхпрестольная церковь, построенная на средства прихожан в 1808. Приделы Кирилловский (тёплый) и Троицкий (холодный), пристроенный с севера в 1849. В советское время закрыта, разрушена. Сохранился лишь фрагмент фасадной стены.;"Введения Пресвятой Богородицы во Храм; Троицы Живоначальной; Кирилла Белозерского";;
29584;Часовня Николая Чудотворца в Свертнево;часовня;;нет данных;сохр.;Вологодская обл., Бабушкинский р-н, д. Свертнево;Деревянная одноглавая кубическая часовня на каменном фундаменте, с трёхсторонней галереей на столбах. Была приписана к Троицкой Новокуножской церкви. Закрыта в 1930-х, использовалась под магазин. В настоящее время закрыта.;Николая Чудотворца;59.408621;43.629210
24161;Часовня в Сверчково;часовня;;нет данных;сохр.;Вологодская обл., Усть-Кубинский р-н, д. Сверчково, напротив д. 11;Большая деревянная часовня, обшитая тёсом, построенная в кон. XIX - нач. ХХ в. Прямоугольный сруб с четырёхскатной кровлей, перекрытой восьмигранным куполом с главкой на световом восьмерике и звонницей над притвором. Утрачено крыльцо, пустует.;;59.681312;39.881175
9679;Церковь Покрова Пресвятой Богородицы в Глухораменье;церковь;;нет данных;сохр.;Вологодская обл., Шекснинский р-н, у д. Селино (СЗ от деревни);Каменная трёх престольная церковь с Космодемьянским и Фроловским приделами. В советское время закрыта, заброшена, разрушается.;"Покрова Пресвятой Богородицы; Флора и Лавра; Космы и Дамиана";59.211282;38.736887
