id;name;type;foundation_date;architect;status;address;short_description;dedications;lat;lon
;;;;;;;;;;
10643;Церковь Илии Пророка на Шухтовском погосте;церковь;не позже 1780-х;нет данных;действ.;Вологодская обл., Череповецкий р-н, с. Абаканово;Каменная однопрестольная церковь, построена в русском эклектичном стиле вместо прежней деревянной Ильинской церкви, пришедшей в ветхость. В конце 1930-х закрыта,использовалась под клуб и склад. Сломаны завершения, утрачена колокольня. В 1992 церковь возвращена верующим, начато восстановление.;Илии Пророка;;
19074;Церковь Покрова Пресвятой Богородицы в Аксеново;церковь;;нет данных;действ.;Вологодская обл., Кирилловский р-н, д. Аксеново;Кирпичная церковь с декором в духе позднего барокко, построенная в 1782. Двусветный четверик с полуглавиями, перекрытый купольным сводом с главкой, двухпридельной трапезной связанный с колокольней под шпилем. Приделы Флоро-Лаврский и Никольский. В 1939 закрыта, но в 1943 возвращена верующим и более не закрывалась.;"Покрова Пресвятой Богородицы; Флора и Лавра; Николая Чудотворца";59.836231;38.424232
9534;Церковь Троицы Живоначальной на Андомском Погосте;церковь;не позже XVI в.;нет данных;сохр.;Вологодская обл., Вытегорский р-н, с. Андомский Погост;;Троицы Живоначальной;61.249582;36.639072
12073;;;;;;;;;;
9471;Церковь Воскресения Христова в Андреевском;церковь;;нет данных;сохр.;Вологодская обл., Бабушкинский р-н, д. Андреевское;Кирпичная двухэтажная четырёхпрестольная церковь в одной связи с колокольней, построена на средства прихожан. Второй этаж с престолом Воскресения Христова надстроен в 1830 на средства приходского сборщика крестьянина Даниила Шумилова. Приделы: Никольский, Георгиевский и Покровский. В советский период закрыта, первый этаж храма занимала МТС, на втором этаже был склад зерна. Колокольня сломана в конце 1950-х, тогда же и храм частично разобрали на кирпич.;"Воскресения Христова; Николая Чудотворца; Покрова Пресвятой Богородицы; Георгия Победоносца";59.750201;44.198470
21691;Церковь Иоанна Богослова в Анисимово;церковь;;нет данных;сохр.;Вологодская обл., Чагодощенский р-н, д. Анисимово;Деревянная однопрестольная Иоанно-Богословская церковь построена в 1850 году на месте старинной часовни. Была домовым храмом дворянской семьи Позен и приписана к Богоявленской Смердомльской церкви. С запада в храм вело крытое крыльцо-тамбур, над которым на четвериковом основании размещалась звонница завершенная невысоким шатром с главкой. Храм закрыт в 1930-х, звонница сломана, помещение использовалось под сельский клуб, школьный спортзал. В настоящее время восстановливается.;Иоанна Богослова;59.174608;35.123411
8897;;;;;;;;;;
5023;Церковь Спаса Нерукотворного Образа на Вытегорском погосте;церковь;не позже конца XV в.;нет данных;сохр.;Вологодская обл., Вытегорский р-н, с. Анхимово;Каменная трёхпрестольная церковь с отдельно стоящей колокольней. Приделы Казанский и Никольский. Построена а 1780 вместо старой деревянной тёплой Никольской церкви. В советское время закрыта, сейчас находится в тяжёлом состоянии.;"Спаса Нерукотворного Образа; Иконы Божией Матери Казанская; Николая Чудотворца; Спаса Нерукотворного Образа";60.951109;36.511403
9468;Церковь Георгия Победоносца в Аргуново;церковь;;нет данных;действ.;Вологодская обл., Никольский р-н, д. Аргуново;Каменная двухэтажная церковь, построена на месте одноименной обветшавшей деревянной. В настоящее время является действующей.;Георгия Победоносца;;
9469;Церковь Михаила Архангела в Аргуново;церковь;;нет данных;сохр.;Вологодская обл., Никольский р-н, д. Аргуново;Каменная церковь с обширной трапезной и колокольней (не сохр.). В советское время закрыта, утрачена колокольня. Здание использовалось как хранилище пиломатериалов. В настоящее время восстанавливается.;Михаила Архангела;;
17313;Церковь Михаила Архангела под Болотом;церковь;не позже XVII в.;1723-1724: Иванов К.;сохр.;Вологодская обл., Междуреченский р-н, ур. Архангельское Болото (1 км З с. Старое);Кирпичная церковь, по внешним формам и декору датируемая 2-й пол. XVIII в. (в литературе ошибочно датируется 1892). Двусветный одноапсидный четверик с трапезной, расширенной в XIX в., и колокольней 1-й пол. XIX в. Закрыта не позже 1930-х, использовалась как мастерские. Пустует, большая часть сводов рухнула.;"Михаила Архангела; Иоанна Предтечи; Успения Пресвятой Богородицы";59.267998;40.645466
10393;;;;;;;;;;
9789;;;;;;;;;;
11174;;;;;;;;;;
11175;;;;;;;;;;
21808;Часовня Зосимы и Савватия Соловецких в Афонинской;часовня;;нет данных;сохр.;Вологодская обл., Харовский р-н, д. Афонинская;Деревянная часовня на подклете, обшитая тесом в основе относящаяся к кон. XVIII - нач. XIX вв. Входила в петряевский приход. Прямоугольный сруб с пятигранным алтарным прирубом, под двускатной кровлей. В XIX в. при расширении сооружена новая западная паперть, установлена декоративная главка. Закрыта не позже 1930-х, использовалась как клуб, склад. Пустует, разрушается.;Зосимы и Савватия Соловецких;60.166125;40.165318
17242;Часовня Флора и Лавра в Афонинской;часовня;1674;нет данных;сохр.;Вологодская обл., Верховажский р-н, д. Афонинская;Часовня, вероятно, выстроенная в 1-й пол. XIX в. и перестроенная в 1860-х. Четверик, завершенный декоративной главкой, с притвором и крыльцом, над притвором был поставлен ярус звона колокольни. Закрыта не позже 1930-х, в сложном состоянии. В 2010 аварийная звонница снята с притвора.;Флора и Лавра;60.728371;41.965113
33367;Церковь Гурия Шалочского в Бабаево;церковь;2006;нет данных;действ.;Вологодская обл., Бабаевский р-н, г. Бабаево, ул. Ухтомского, 20Б;Кирпичная однопрестольная церковь строилась в два этапа из-за недостатка средств, в 2006-2008 и 2017-2019 годах. Освящена 24 нояб. 2019. Квадратная в плане постройка, завершенная пятиглавием, с трёхчастной апсидой, с отдельно стоящей деревянной колокольней.;Гурия Шалочского;59.388381;35.948505
12029;Церковь Петра и Павла в Бабаево;церковь;1990;нет данных;действ.;Вологодская обл., Бабаевский р-н, г. Бабаево, ул. Карла Маркса, 14А;Православный приход зарегистрирован в 1990. Ныне существующая церковь устроена в 1994 в приспособленном деревянном здании бывшего швейного цеха, выделена главкой и звонницей.;Петра и Павла;59.389424;35.953242
20571;Церковь Рождества Христова на Бадожском Погосте;церковь;;нет данных;сохр.;Вологодская обл., Вытегорский р-н, д. Бадожский Погост;Деревянная церковь, обшитая тесом, поставленная на высокий подклет, сооруженная в 1778 и перестроенная в 1892-1894. Служила зимним храмом прихода. Четверик, перекрывавшийся купольной кровлей с малым восьмериком и четырьмя малыми главками по углам, с широкой пятигранной апсидой и трапезной. Второй престол Знаменский. Закрыта не позже 1930-х. Пустует, в сложном техническом состоянии, кровля трапезной рухнула.;"Рождества Христова; Иконы Божией Матери Знамение";60.689344;37.131767
9531;Церковь Введения Пресвятой Богородицы во Храм в Байдарово;церковь;не позже 3-й четв. XVII в.;нет данных;действ.;Вологодская обл., Никольский р-н, д. Байдарово;Каменная двухэтажная шестипрестольная церковь, в одной связи с колокольней, построена на средства прихожан вместо прежней каменной. Закрыта в начале 1930-х, в здании устроен хлебоприемный пункт. В 1990-х были начаты восстановительные работы, но так и не завершены. Вновь возобновлены в 2008. Приход нуждается в помощи.;"Введения Пресвятой Богородицы во Храм; Иконы Божией Матери Достойно есть (Милующая); Иоанна Устюжского; Модеста, патриарха Иерусалимского; Николая Чудотворца; Прокопия Устюжского; Власия, епископа Севастийского";59.653415;45.541153
17309;Церковь Николая Чудотворца на Комье;церковь;не позже нач. XVII в.;нет данных;действ.;Вологодская обл., Грязовецкий р-н, д. Барское;"Кирпичная тёплая церковь, вероятно, выстроенная в кон. XVIII - нач. XIX вв. Четверик с трапезной и колокольней. Имелись Михаило-Архангельский и Предтеченский приделы. В 1930-х закрыта и разрушена. В 1991-1993 попечением главы колхоза ""Аврора"" Н. М. Подгорнова на его месте построена небольшая кирпичная церковь - интересный пример современной интерпретации форм неорусского стиля.";"Николая Чудотворца; Обретения Главы Иоанна Предтечи; Михаила Архангела";59.021177;40.291629
10782;Церковь Богоявления Господня в Батране;церковь;;нет данных;сохр.;Вологодская обл., Череповецкий р-н, д. Батран;Каменная летняя трехпрестольная церковь, построена на средства прихожан. Приделы: Ильинский и Казанский. В советское время закрыта, ныне заброшена, разрушается.;"Богоявления Господня; Иконы Божией Матери Казанская; Илии Пророка";58.967644;38.406043
10783;Церковь Екатерины Великомученицы в Батране;церковь;;нет данных;сохр.;Вологодская обл., Череповецкий р-н, д. Батран;Каменная зимняя однопрестольная церковь с ярусной колокольней, построена на средства местной помещицы княжны Екатерины Мещерской. В советское время закрыта, ныне заброшена, разрушается.;Екатерины Великомученицы;58.967958;38.406502
10784;Церковь Илии Пророка в Батране;церковь;;нет данных;действ.;Вологодская обл., Череповецкий р-н, д. Батран;Новопостроенная одноглавая деревянная церковь - куб под восьмискатной крышей, с примыкающими небольшими объёмами алтаря и притвора.;Илии Пророка;58.967689;38.406714
11257;Церковь Николая Чудотворца в Бекетовской;церковь;;нет данных;сохр.;Вологодская обл., Вожегодский р-н, д. Бекетовская;Кирпичная однопрестольная церковь, построенная в 1900 при Петропавловском храме. Закрыта не позже 1930-х, перестроена.;Николая Чудотворца;;
11256;Церковь Петра и Павла в Бекетовской;церковь;;нет данных;сохр.;Вологодская обл., Вожегодский р-н, д. Бекетовская;Кирпичная церковь, построенная в 1802 и расширенная в сер. XIX в. Четверик с боковыми Никольским и Казанским приделами. Закрыта не позже 1930-х, венчания сломаны. Используется под гараж.;"Петра и Павла; Николая Чудотворца; Иконы Божией Матери Казанская";;
8808;Церковь Троицы Живоначальной в Беленицыно;церковь;;нет данных;сохр.;Вологодская обл., Харовский р-н, д. Беленицыно;Каменная церковь с трапезной и колокольней. В советское время закрыта, завершения сломаны, разобраны верхние ярусы колокольни. Заброшена, разрушается.;Троицы Живоначальной;59.950012;40.312341
6903;Собор Преображения Господня в Белозерске;церковь;не позже XIV в.;1967-1972: Лелекова О. В. – реставрация (иконы);сохр.;Вологодская обл., Белозерский р-н, г. Белозерск, ул. Советский Вал;Кирпичный четырёхстолпный трёхапсидный храм, завершённый пятью луковичными куполами на крупных барабанах. Выстроен в духе соборного зодчества XVI в., прясла, на которые поделены фасады, завершены крупными закомарами. Заложен в 1668, окончен в конце 1670-х, западный притвор XIX в. Закрыт в 1930-х, поддерживался в порядке. В настоящее время принадлежит городскому музею.;Преображения Господня;60.031536;37.784692
12560;Церковь Богоявления Господня в Белозерске;церковь;;нет данных;действ.;Вологодская обл., Белозерский р-н, г. Белозерск, ул. Карла Маркса;Зимняя церковь при Успенском храме, построенная, вероятно, в сер. XVIII в. (в литературе датируется 1784). Двусветный четверик с небольшими полуглавиями, завершённый единственной главкой, трапезной связанный с трёхъярусной колокольней в стиле классицизма. С севера пристроен Благовещенский придел, в верхней части четверика выгорожен второй этаж для престола во имя Димитрия Ростовского. Закрыта в 1930-х, занята гаражом. В сер. 1940-х возвращена верующим.;"Богоявления Господня; Димитрия, митрополита Ростовского; Благовещения Пресвятой Богородицы";60.029137;37.795504
12738;Церковь Илии Пророка в Белозерске;церковь;не позже нач. XVII в.;Рубеж 1960-х - 1970-х: Гнедовский Б. В. – реставрация;сохр.;Вологодская обл., Белозерский р-н, г. Белозерск, ул. Шукшина, 21;Летний храм Ильинско-Покровского прихода. Деревянная церковь, построенная в 1696. Четверик с одноглавым ярусным завершением, с пятигранным алтарём, двустолпной трапезной и притвором. В XIX в. обшита тесом. Закрыта в 1930-х, находилась в ведении музея. В 1970-х отреставрирована со снятием тесовой обшивки, к 2000-м в тяжёлом состоянии из-за подгнивания нижних венцов. С 2010 реставрируется методом полной переборки.;Илии Пророка;60.031756;37.772928
20271;Церковь Иоанна Богослова в Белозерске;церковь;;нет данных;сохр.;Вологодская обл., Белозерский р-н, г. Белозерск, угол ул. Дзержинского и ул. Юных Коммунаров;Кирпичная церковь, датируемая 1706, но судя по фасадному декору, реконструированная в кон. XVIII в. Здание типа восьмерик на четверике с двухпридельной трапезной, в которой помещались Воздвиженский (в 1883 перенесенный в новую пристройку) и Симеоновский приделы, и шатровой колокольней. Закрыта в нач. 1930-х, капитально перестроена. Долгое время использовалась как пожарное депо, сейчас - развлекательный центр.;"Иоанна Богослова; Симеона Столпника; Воздвижения Честного Креста Господня";60.031114;37.790485
20272;;;;;;;;;;
20274;Церковь Петра и Павла в Белозерске;церковь;;нет данных;действ.;Вологодская обл., Белозерский р-н, г. Белозерск, ул. Фрунзе, 22;Кирпичная церковь, построенная в 1770, с декором в духе традиционного зодчества. Трёхсветный четверик с полуглавиями, завершённый пятью главками с перетяжками, с пятигранным алтарём, обширной трапезной 1-й пол. XIX в. и трёхъярусной колокольней. Второй престол Похвалы Богородицы, в трапезной в XIX в. устроены Скорбященский, Златоустовский и Сорокосвятский приделы. Во втором ярусе колокольни был устроен Космодамианский придел. С XIX в. приписана к Рождество-Богородицкой церкви. Закрыта в 1930-х, колокольня и верхняя часть четверика сломаны. Долгое время была занята отделом статистики, в 1990-х передана краеведческому музею. С окт. 2016 храм передан Череповецкой епархии. Создан приход, богослужения два раза в неделю.;"Петра и Павла; Иоанна Златоуста; Космы и Дамиана; Похвалы Пресвятой Богородицы; Иконы Божией Матери Всех Скорбящих Радость";60.033145;37.793019
7173;;;;;;;;;;
7172;Церковь Рождества Иоанна Предтечи в Белозерске;церковь;не позже XVII в.;1810: Баженов В. И. (?);сохр.;Вологодская обл., Белозерский р-н, г. Белозерск, ул. III-го Интернационала;Кирпичная церковь в формах зрелого московского классицизма, сооружённая в 1810 на средства купца И. Горина вместо каменного Троицкого храма XVIII в. Ротондальная постройка, завершавшаяся куполом с главкой, с боковыми приделами со скругленными углами, трапезной со скругленными углами и полукруглым алтарём. Имелись Троицкий, Предтеченский, Введенский, Зосимо-Савватиевский и Казанский приделы. Закрыта в 1932, ротонда сломана. Первоначально передавалась под музей, позже долго была занята машинно-тракторной станцией. В настоящее время заперта, пустует.;"Рождества Иоанна Предтечи; Введения Пресвятой Богородицы во Храм; Зосимы и Савватия Соловецких; Иконы Божией Матери Казанская; Троицы Живоначальной";60.035839;37.800306
