id;name;type;foundation_date;architect;status;address;short_description;dedications;lat;lon
12470;Церковь Николая Чудотворца на Верхней Еденьге;церковь;;нет данных;сохр.;Вологодская обл., Тотемский р-н, д. Матвеево;"Кирпичная двухэтажная церковь ""кораблём"", построенная в 1778-1796. Здание состоит из высокого четверика храма, перекрытого сомкнутым сводом и завершенного малым восьмериком, пятигранной апсиды и трапезной. Интересна постановка яруса звона колокольни над юго-западным углом трапезной. Декоративное убранство выполнено в стиле тотемского барокко. Закрыта не позже 1930-х, в настоящее время заброшена.";Николая Чудотворца;60.085479;42.802563
17247;Часовня Зосимы и Савватия Соловецких в Фоминой Горе;часовня;;нет данных;сохр.;Вологодская обл., Верховажский р-н, д. Матвеевская (Верховское с/п);Деревянная часовня, построенная, вероятно, в кон. XIX в., входила в Верховский приход. Четверик, завершённый четырёхскатной кровлей с главкой, с притвором (утрачен). Закрыта не позже 1930-х. Находится в аварийном состоянии.;Зосимы и Савватия Соловецких;60.656899;41.818991
21701;Церковь Иконы Божией Матери Тихвинская в Мегрино;церковь;;нет данных;действ.;Вологодская обл., Чагодощенский р-н, д. Мегрино;Каменная, в одной связи с колокольней, Тихвинская церковь построена на замену обветшавшей деревянной (1775) того же посвящения на древнем Мегринском Ильинском погосте. Главный престол — иконы Божией Матери Тихвинская, приделы: пророка Илии и Николая Чудотворца. Основной объем храма завершен четырехскатной кровлей, деревянным световым барабаном с полуциркульными окнами и полусферическим куполом. Двухъярусная колокольня завершена высоким шпилем с яблоком и крестом. Храм закрыт одним из первых в районе в 1929, в 1930-х сломаны завершения и колокольня, были устроены междуэтажные перекрытия, пробиты новые окна – в храме разместилась школа (до начала 1970-х). После пожара 1983 обрушились кровля и перекрытия, храм превратился в развалины. Восстановление силами местных жителей началось в 1995, в 2002 начались строительные работы, в 2007 году храм освящен.;"Иконы Божией Матери Тихвинская; Николая Чудотворца; Илии Пророка";59.147144;35.576150
12472;Церковь Воскресения Христова в Медведево;церковь;сер. XVIII в.;нет данных;сохр.;Вологодская обл., Тотемский р-н, д. Медведево;Кирпичная двухэтажная церковь, построенная в 1756 (по другим данным в 1761) на средства купца И. Лебзинова, хороший образец устюжского зодчества сер. XVIII в. Высокий четверик с полуглавиями завершён малым восьмериком с главкой и богато украшен декором. С запада к церкви примыкали трапезная и высокая колокольня, построенная в 1884-1895, с востока - пятигранный алтарь. Второй престол Василия Великого. Закрыта не позже 1930-х, сломаны колокольня, второй этаж трапезной. Заброшена.;"Воскресения Христова; Василия Великого";60.025900;43.018800
6168;Церковь Рождества Пресвятой Богородицы в Междуозерском Родионовском погосте;церковь;1537;нет данных;сохр.;Вологодская обл., Белозерский р-н, ур. Междуозерский Родионовский пог.;Кирпичная трёхпрестольная церковь на берегу Родионовского озера (ранее Илозеро). Приделы Иродионовский и Похвалинский. Церковь стоит на месте бывшей здесь Иродионовой Илоезерской Озадской мужской пустыни, основанной преподобным Иродионом Илоезерским и упразднённой в 1764, с обращением церкви в приходскую. В советское время закрыта, заброшена.;"Рождества Пресвятой Богородицы; Иродиона Илоезерского; Похвалы Пресвятой Богородицы";59.774997;37.854925
11178;Часовня Александра Невского в Меленке;часовня;не позже XIX в.;нет данных;действ.;Вологодская обл., Сокольский р-н, д. Меленка;Большая деревянная одноглавая часовня простой архитектуры. Приписана к церкви в Архангельском. Была закрыта не позже 1930-х, занята под склад, общежитие. Отремонтирована с упрощением архитектурных форм в 1980-х и повторно в 2008.;Александра Невского;;
14157;Александро-Куштская Успенская пустынь;монастырь;1420;нет данных;действ.;Вологодская обл., Усть-Кубинский р-н, с. Место Александрово;"Мужской монастырь, основанный в 1420 прп. Александром Куштским, иноком Спасо-Каменного монастыря, при помощи князя Заозерского Димитрия Васильевича. В 1764 упразднён, обращён в приход. В 1833 восстановлен как приписанный к Спасо-Каменному монастырю. Закрыт в 1920-х, занят психоневрологическим интернатом. 6 окт. 2017 указом митрополита Вологодского и Кирилловского Игнатия (Депутатова) на территории бывшего монастыря образовано Архиерейское подворье ""Свято-Успенский Александро-Куштский монастырь"".";;59.588216;39.703082
14159;Церковь Александра Куштского в Александро-Куштской Успенской пустыни;церковь;1440-е;нет данных;действ.;Вологодская обл., Усть-Кубинский р-н, с. Место Александрово;Кирпичная двухэтажная церковь, построенная в 1835. Прямоугольное в плане одноапсидное здание с декором в стиле классицизма, увенчанное невысоким деревянным четвериком под куполом, с колокольней. Престолы во имя прп. Александра (вверху) и Николая Чудотворца (внизу). Закрыта не позже 1930-х, колокольня сломана, использовалась как баня. В настоящее время восстановлена, единственная действующая церковь монастыря.;"Александра Куштского; Николая Чудотворца";59.588023;39.703045
27076;Церковь Николая Чудотворца на Еленге;церковь;не позже нач. XVII в.;нет данных;сохр.;Вологодская обл., Вологодский р-н, у д. Минино (Березниковский с/с);Кирпичная трёхпрестольная церковь построена в 1829 вместо предыдущей. Здание - четверик с трапезной и колокольней в связи. Смоленский придел освящён 16 нояб. 1869, придел Иоанна Богослова - в 1916. Закрыта в 1930-х, использовалась в хозяйственных целях. Утрачены завершения, разрушается.;"Николая Чудотворца; Иоанна Богослова; Иконы Божией Матери Смоленская";59.662984;39.029544
20329;Церковь Димитрия Солунского на Дмитриевском Карачевском погосте;церковь;не позже нач. XVII в.;нет данных;сохр.;Вологодская обл., Вологодский р-н, д. Минино (Нефедовский с/с);Кирпичная церковь с декором в стиле классицизма, построенная в 1828. Имелись Троицкий и Флоро-Лаврский приделы. Закрыта не позже 1930-х, позже в основном разобрана. До наших дней уцелела только южная половина четверика без сводов.;"Димитрия Солунского; Флора и Лавра; Троицы Живоначальной";59.741212;39.151204
11102;;;;;;;;;;
8807;Церковь Михаила Архангела в Михайловском;церковь;;1831: Трубчанкин Н. А.;сохр.;Вологодская обл., Харовский р-н, с. Михайловское;Каменная двухэтажная церковь. Закрыта в советское время, частично перестроена (сломаны завершения и верхние ярусы колокольни). Ныне в здании располагается Михайловская основная общеобразовательная школа.;Михаила Архангела;59.965677;40.476492
6165;Николо-Моденский мужской монастырь;монастырь;1-я треть XVI в.;нет данных;сохр.;Вологодская обл., Устюженский р-н, с. Модно;По местным преданиям Моденский монастырь построен на средства московского купца Строганова на месте явления иконы Николая Чудотворца. Закрыт в 1930, к 1944 разрушен почти полностью, остались лишь сильно перестроенные кельи. В настоящее время на месте монастыря находится детский лагерь отдыха.;;58.927355;36.903565
11100;Часовня Петра и Павла в Слободке;часовня;не позже 3-й четв. XVII в.;нет данных;действ.;Вологодская обл., Верховажский р-н, д. Моисеевская (Верховское с/п);Крупная деревянная часовня, обшитая тёсом, построенная во 2-й пол. XIX в. в дальней деревне верховского прихода. Прямоугольный сруб с главкой на кровле и колокольней над притвором. Отремонтирована в 2011-2012.;Петра и Павла;60.582744;41.707937
22883;Церковь Воскресения Христова в Молочном;церковь;1995;нет данных;действ.;Вологодская обл., г. Вологда, с. Молочное, ул. Советская, 9;Православный приход храма Воскресения Христова в Молочном основан в 1995, тогда же принято решение о восстановлении сохранившейся каменной Успенской часовни Воскресенского-Ракульского погоста. Одноглавая кубическая часовня построена в 1905 на кладбище при Воскресенской церкви. Закрыта в кон. 1920-х, использовалась под жильё, ветеринарную лечебницу. Восстановлена в 2000, освящена как церковь Воскресения Христова 9 марта 2003.;Воскресения Христова;59.283576;39.681460
27144;Церковь Михаила Архангела в Молочном;церковь;2016;нет данных;действ.;Вологодская обл., Вологодский р-н, с. Молочное, ул. Маяковского;Каменная церковь, строящаяся в связи с малой вместимостью Воскресенской церкви. Участок выделен и освящен в 2016, поклонный крест на месте алтаря освящен 5 окт. 2018. Выстроена деревянная одноглавая церковь клетского типа. Освящена 17 окт.2024.;Михаила Архангела;59.288964;39.677717
5465;Гледенский Троицкий мужской монастырь;монастырь;рубеж XII - XIII вв.;нет данных;сохр.;Вологодская обл., Великоустюгский р-н, д. Морозовица, ул. Центральная, д. 122;Монастырь основан на горе Гледен, при слиянии рек Сухоны и Юга, во время правления кн. Всеволода III Юрьевича. В 1841 потерял самостоятельность и был приписан к Михаило-Архангельскому монастырю в Великом Устюге. Считается одной из старейших обителей Вологодской губернии. В 1925 закрыт, постройки использовались для размещения детской колонии, пересыльного пункта для раскулаченных, затем как дом престарелых. В 1980-х передан Устюжскому музею.;;60.718391;46.310080
5466;Собор Троицы Живоначальной в Гледенском Троицком монастыре;церковь;;1780-е: Аленёв В. А. – интерьеры, внутренний/внешний декор (иконы);действ.;Вологодская обл., Великоустюгский р-н, д. Морозовица, ул. Центральная, д. 122;Холодный пятиглавый собор, окружённый двухэтажными крытыми галереями. Известен своим золочёным иконостасом в стиле барокко, богато украшенным резьбой (резчики — тотемские мастера братья Николай и Тимофей Богдановы). С 2024 ведутся службы по большим праздникам.;Троицы Живоначальной;60.718556;46.309811
5467;Церковь Иконы Божией Матери Тихвинская в Гледенском Троицком монастыре;церковь;;нет данных;сохр.;Вологодская обл., Великоустюгский р-н, д. Морозовица, ул. Центральная, д. 122;Тёплая церковь при трапезных палатах, с Никольским приделом. Была соединена с Троицким собором галереями (ныне утрачены).;"Иконы Божией Матери Тихвинская; Николая Чудотворца";60.718281;46.310522
5468;Церковь Успения Пресвятой Богородицы в Гледенском Троицком монастыре;церковь;;нет данных;сохр.;Вологодская обл., Великоустюгский р-н, д. Морозовица, ул. Центральная, д. 122;Одноглавая церковь при больничных палатах, основной объём - восьмерик на четверике. Типичный образец культового зодчества XVIII в.;Успения Пресвятой Богородицы;60.718796;46.308521
5469;Церковь Иоанна Устюжского в Пухово;церковь;не позже кон. XVII;нет данных;сохр.;Вологодская обл., Великоустюгский р-н, д. Морозовица;Однопрестольная кирпичная церковь, построенная вне стен Гледенского Троицкого монастыря. Устроена монастырским тщанием в 1764 вместо деревянной часовни (церкви?) в пустоши Пухово, на предполагаемом месте рождения Иоанна Устюжского. Церковь центрического типа, крестообразная в плане, двухсветный восьмерик основного объёма завершён восьмигранным куполом и малым световым восьмериком с главкой. Закрыта в 1925, обрушилась в 1990-х.;Иоанна Устюжского;60.719531;46.299937
13614;Церковь Спаса Нерукотворного Образа в Морозовице;церковь;не позже XVII в.;нет данных;сохр.;Вологодская обл., Великоустюгский р-н, д. Морозовица;"Каменная одноэтажная церковь построена ""тщанием торгового человека Михаила Суковатицына и прихожан"" вместо двух ветхих деревянных. Двухсветный четверик, перекрытый шестигранным куполом, с трапезной и южным приделом. В кон. XVIII в. возводится колокольня, в 1859 пристраиваются сторожка и притвор. Трёхпрестольная: Спаса Нерукотворного Образа - главный, приделы Рождества Пресвятой Богородицы и Петра, митрополита Московского. Закрыта в 1937-1938, до 1990-х в помещении храма размещалась МТС, после чего здание было заброшено. С 2010 идут восстановительные работы.";"Спаса Нерукотворного Образа; Петра, митрополита Московского; Рождества Пресвятой Богородицы";60.710707;46.306513
33368;Часовня Иоанна Устюжского в Морозовице;часовня;2023;2023: Остроумов Д. А.;действ.;Вологодская обл., Великоустюгский р-н, д. Морозовица;Деревянная часовня с купальней построена в 2023 у чтимого источника по проекту мастерской Прохрам на средства благотворителей. Представляет собой четверик под килевидной крышей с главкой. Освящена 11 июня 2023.;Иоанна Устюжского;60.719784;46.300154
22675;Часовня Иоанна Устюжского в Пухово;часовня;1899;нет данных;сохр.;Вологодская обл., Великоустюгский р-н, д. Морозовица;"Приписная к приходу Спасской Морозовской церкви придорожная кирпичная часовня устроена иждивением прихожан ""во имя святого блаженного Иоанна Устюжского и в память коронования Высочайших Особ"". Закрыта в нач. 1930-х. Планируются восстановительные работы.";Иоанна Устюжского;60.718825;46.293694
33365;;;;;;;;;;
14040;Церковь Преображения Господня в Новолеушинском Иоанно-Предтеченском монастыре;церковь;не позже 1-й пол. XV в.;нет данных;сохр.;Вологодская обл., Череповецкий р-н, с. Мякса, ул. Советская, 27;Однопрестольная каменная летняя церковь, построена на средства прихожан в 1810. Основной объём храма - двухсветный четверик с пятиглавым завершением, с трёхъярусной шатровой колокольней (не сохр.). Закрыта в 1937, сломаны завершения, использовалась не по назначению, заброшена. С 2016 относится к Новолеушинскому Иоанно-Предтеченскому монастырю, восстанавливается.;Преображения Господня;58.890761;38.193470
14041;Церковь Рождества Иоанна Предтечи в Новолеушинском Иоанно-Предтеченском монастыре;церковь;нач. 2000-х;нет данных;действ.;Вологодская обл., Череповецкий р-н, с. Мякса, ул. Советская, 29;"Деревянная однопрестольная церковь, устроена при вновь открытом Преображенском приходе в Мяксе. Основной объём храма - низкий восьмерик на высоком четверике под пятиглавым завершением; трапезная в одной связи с колокольней. 14 июня 2015 переосвящена в честь Иоанна Предтечи. С 2016 является главным храмом вновь открытого Новолеушинского Иоанно-Предтеченского монастыря.";"Преображения Господня; Рождества Иоанна Предтечи";58.890251;38.194129
14039;Церковь Рождества Христова в Новолеушинском Иоанно-Предтеченском монастыре;церковь;не позже 1-й пол. XV в.;нет данных;действ.;Вологодская обл., Череповецкий р-н, с. Мякса, ул. Советская, 25;Двухпрестольная каменная тёплая церковь с Казанским приделом, построена на средства прихожан в 1785. Основной объём храма - двухсветный четверик. Закрыта в 1936, сломаны завершения, в здании размещался военкомат. В 2006 возвращена епархии, в отремонтированном здании расположена церковь и приходская школа. На основе храма в 2016 открыт Новолеушинский Иоанно-Предтеченский монастырь.;"Рождества Христова; Иконы Божией Матери Казанская";58.890464;38.193435
