id;name;type;foundation_date;architect;status;address;short_description;dedications;lat;lon
3760;Церковь Покрова Пресвятой Богородицы, что на Торгу;церковь;1560-е;нет данных;действ.;Вологодская обл., г. Вологда, Торговая пл., 8;Кирпичная одноглавая церковь на подклете в духе вологодского барокко, построенная в 1778-1780 на средства купца Пояркова. Одноглавый четверик под купольным сводом с небольшой трапезной и шатровой колокольней. Имелись приделы Иоакима и Анны и Макария Унженского (ныне не освящены). Закрыта в 1926, занята архивом. Возвращена верующим в 1991, отреставрирована, освящена 15 февр. 1992.;"Покрова Пресвятой Богородицы; Макария Желтоводского; Иоакима и Анны";59.223487;39.886798
7524;Церковь Рождества Пресвятой Богородицы, что на Нижнем Долу;церковь;не позже XVI в.;нет данных;действ.;Вологодская обл., г. Вологда, Пречистенская наб., 5;Кирпичная церковь в духе провинциального барокко, построенная в 1779. Четверик, перекрытый купольной кровлей с главкой, трапезной связан с невысокой двухъярусной колокольней. В трапезной были приделы Никольский и Григория Пельшемского. Закрыта в 1930, венчания сломаны. Долгое время была занята производством, затем заброшена. В настоящее время возвращена верующим, восстанавливается, в храме совершаются богослужения.;"Рождества Пресвятой Богородицы; Григория Пельшемского; Николая Чудотворца";59.220966;39.908327
3685;Церковь Рождества Христова на Архиерейском дворе;церковь;1667;нет данных;сохр.;Вологодская обл., г. Вологда, ул. Сергея Орлова, 15;Храм в восточной части трехэтажного кирпичного Симоновского корпуса архиерейского двора. Сооружен в 1667-1670 еп. Симоном, внешне выделен высоким одноглавым (первоначально пятиглавым) четвериком. Был упразднён во 2-й пол. XVIII в., в XIX в. использовался для хранения архива консистории. С 1920-х в ведении музея, в 1970-х частично отреставрирован. В помещении храма размещена музейная экспозиция.;Рождества Христова;59.223820;39.881665
3713;Церковь Сретения Господня;церковь;не позже сер. XVII в.;нет данных;действ.;Вологодская обл., г. Вологда, наб. VI Армии, 85;Кирпичная церковь на подклете, сооружённая в 1731-1735. Пятиглавый четверик с трапезной, интересный наличием в декоре изразцов и элементов московского барокко. Приделы Никольский и Святителей Московских. Колокольня в стиле ампир с чертами неоготики сооружена вместо старой в 1830-х. Закрыта в 1930, занята общежитием, поддерживалась в порядке. Ныне возвращена верующим, первое богослужение проведено 4 нояб. 2016.;"Сретения Господня; Трех Святителей Московских; Николая Чудотворца";59.227343;39.879792
7504;Церковь Сретения Иконы Божией Матери Владимирская Владимирского прихода;церковь;не позже 1-й пол. XVI в.;нет данных;сохр.;Вологодская обл., г. Вологда, ул. Октябрьская, 46Б;Летняя церковь владимирского прихода. Выстроена в 1759-1764 на средства прихожан к западу от теплой. Двусветный четверик с купольной кровлей и ярусной главкой, близкий к памятникам устюжского барокко, с алтарем и папертью. Имелся придел Антония и Феодосия Печерских, упраздненный в 1861. Закрыта в 1929. Отреставрирована в 1970-х. Занята стекольной мастерской, поддерживается в порядке.;"Сретения Иконы Божией Матери Владимирская; Антония и Феодосия Киево-Печерских";59.222195;39.869648
7526;Церковь Усекновения Главы Иоанна Предтечи в Рощенье;церковь;не позже 2-й пол. XVI в.;;действ.;Вологодская обл., г. Вологда, Предтеченская, 28;Кирпичный храм типа восьмерик на четверике с декором в духе московского барокко, с трапезной и колокольней. Построен по храмозданной грамоте 1710, южный придел к трапезной пристроен в 1860-1863, колокольня перестроена в 1865. Приделы в трапезной Алексия, митрополита Московского, и Иннокентия Иркутского (с 1832). Закрыт в 1924, занят складом, но поддерживался в порядке. Возвращен верующим в 2006.;"Усекновения Главы Иоанна Предтечи; Иннокентия, епископа Иркутского; Алексия, митрополита Московского";59.217929;39.896092
3759;Церковь Успения Пресвятой Богородицы;церковь;не позже сер. XVIII в.;нет данных;действ.;Вологодская обл., г. Вологда, наб. VI Армии, 119;Теплый кирпичный храм при церкви Димитрия на Наволоке. Выстроен в 1750-1759 на средства купца А. А. Рыбникова, первоначально Всехсвятский, переосвящен в Успенский в 1836. Одноглавая церковь с ярусной колокольней в духе барокко, второй престол — Ярославских Чудотворцев. Закрыт в 1930, занят складами. Возвращен верующим в 1995. В настоящее время относится к Дмитриевскому архиерейскому подворью.;"Успения Пресвятой Богородицы; Феодора, Давида и Константина Ярославских";59.224301;39.893682
7534;Молитвенная комната Симеона Богоприимца при ИЗ-2;часовня;1883;нет данных;действ.;г. Вологда, ул. Чернышевского;Домовая Скорбященская церковь в арестантской исправительной тюрьме, устроена в 1883. Закрыта в 1918, помещение перестроено. В настоящее время в размещенном в тюрьме СИЗО (ИЗ-2) устроена новая молитвенная комната Симеона Богоприимца.;"Симеона Богоприимца; Иконы Божией Матери Всех Скорбящих Радость";59.235912;39.899865
7537;Часовня Арсения Комельского;часовня;нач. ХХ в.;нач. ХХ в.: Шильдкнехт В. Н.;сохр.;г. Вологда, Советский просп., 10;Часовня в стиле неоготики. Сооружена Арсениев-Комельским монастырем в нач. ХХ в. Закрыта в 1924. Поддерживается в порядке, в настоящее время занята кафе.;Арсения Комельского;59.217696;39.893481
7538;Часовня Белоризцев;часовня;не позже XVII в.;нет данных;сохр.;г. Вологда, ул. Бурмагиных;Крупная кирпичная кубическая часовня в псевдорусском стиле, построенная в 1911 на средства А. И. Карауловой. Была приписана к Лазаревской церкви. Закрыта в 1929. В настоящее время занята жильём.;;59.235760;39.868669
6830;Часовня Иконы Божией Матери Владимирская;часовня;2000;;действ.;Вологодская обл., г. Вологда, ул. Сергея Орлова, парк ВРЗ (Соборная горка);Памятный Знак - часовня по увековечению 2000-летия Христианства и вступления России в третье тысячелетие. Кирпичная одноглавая кубическая постройка, возведённая с использованием форм зодчества XIV-XV вв., выстроена в 2000-2002.;Иконы Божией Матери Владимирская;59.225153;39.879841
7252;Часовня Николая Вологодского;часовня;1899;нет данных;действ.;г. Вологда, Говоровский пр., 2;Кирпичная часовня на могиле блаж. Николая Вологодского (Рынина). Однокупольная постройка в духе эклектики. Закрыта в 1938, вновь возвращена верующим в 1988, отремонтирована.;Николая Вологодского;59.206792;39.873097
7542;Часовня при Вологодском техникуме железнодорожного транспорта;часовня;нач. 2000-х;нет данных;действ.;Вологодская обл., г. Вологда, Техникумовский пер., 4;Небольшая деревянная Васильевская часовня простой архитектуры при вологодском железнодорожном техникуме, сооруженная в нач. 2000-х.;;59.207674;39.887511
24159;Часовня Иоанна Богослова в Горшково;часовня;;нет данных;сохр.;Вологодская обл., Усть-Кубинский р-н, ур. Горшково;Деревянная кубическая пятиглавая часовня с закрытым крыльцом и звонницей над притвором. Приписная к Троицкой церкви в Ивановском. Находится в сложном техническом состоянии, за период с 2007 по 2015 утрачено крыльцо с главкой.;Иоанна Богослова;59.960795;39.298170
15303;Церковь Сошествия Святого Духа в Гоше;церковь;;нет данных;сохр.;Вологодская обл., Череповецкий р-н, с. Гоша;Деревянная церковь, обшитая тесом построенная в 1913 в дальней деревне даргунского прихода. Крестообразное в плане здание с декором в духе эклектики. Второй престол Александры Царицы. Закрыта не позже 1930-х, венчания сломаны. В 2016 воссоздан приход, пытающийся возродить церковь.;"Сошествия Святого Духа; Александры Царицы";59.054845;38.336349
24160;Часовня Вознесения Господня  в Гризино;часовня;;нет данных;сохр.;Вологодская обл., Усть-Кубинский р-н, д. Гризино;Деревянная, обшитая тёсом часовня, построенная в русском эклектическом стиле в 1912, по другим данным в 1860-1870 (?). Входила в приход Трифоновой Уфтюжской церкви. Четверик основного объёма завершён пятиглавием, входное крыльцо и фальш-крыльца трёх других фасадов также завершены главками. Находится в сложном техническом состоянии.;Вознесения Господня;59.881659;39.293696
15868;Церковь Воздвижения Честного Креста Господня в Грязовце;церковь;;нет данных;действ.;Вологодская обл., Грязовецкий р-н, г. Грязовец, ул. Карла Маркса, 90;Кирпичная церковь с декором в стиле барокко, построенная в 1794 как кладбищенский храм. Двусветный одноглавый четверик, верхняя часть которого сложена из дерева, с трапезной с южным приделом Иоанна Златоуста и трёхъярусной колокольней в стиле классицизма, пристроенными в 1845. Закрыта в 1930-х, венчания сломаны. В сер. 1940-х возвращена верующим, более не закрывалась.;"Воздвижения Честного Креста Господня; Иоанна Златоуста";58.880101;40.264871
15870;Церковь Игнатия (Брянчанинова), епископа Кавказского, в Грязовце;церковь;1996;2004-2013: Барабанов А. Б.;действ.;Вологодская обл., Грязовецкий р-н, г. Грязовец, пос. Газовиков;"Деревянная церковь, заложенная в 1996 на южной окраине города, в посёлке при компрессорной станции газопровода, на средства ""Севергазпрома"". Строительство начато в 2004 и окончено в кон. 2000-х. Крестообразный в плане храм на каменном цоколе, завершённый звонницей под шатром. Освящён 11 февр. 2013.";"Игнатия (Брянчанинова), епископа Кавказского; Иоанна Златоуста";58.868794;40.250166
15869;Церковь Корнилия Комельского в Грязовце;церковь;1991;нет данных;действ.;Вологодская обл., Грязовецкий р-н, г. Грязовец, ул. Карла Маркса, 90;Кирпичный храм рядом с Воздвиженской церковью, сооруженный в 1991-2002 при помощи предпринимателя А. П. Столярова, местного уроженца. Одноглавый четверик с колокольней.;"Корнилия Комельского; Иоанна Златоуста";58.880267;40.263712
15324;Церковь Успения Пресвятой Богородицы в Девятинах;церковь;не позже XVI в.;нет данных;сохр.;Вологодская обл., Вытегорский р-н, с. Девятины;Деревянный храм с ярусным покрытием, построенный в 1770, состоял из четверика с прямоугольным алтарем и трапезной. Четверик завершался крещатыми бочками ломаных очертаний, несшими четыре малые главки и низкий восьмерик, на котором стояла центральная главка. Второй престол Рождества Предтечи. Закрыта не позже 1930-х, сгорела в 1984. В сер. 2000-х на ее месте поставлена новая деревянная церковь, представляющая собой прямоугольный двухкупольный сруб с алтарем и притвором. Отделка не окончена, не освящена.;"Успения Пресвятой Богородицы; Рождества Иоанна Предтечи";60.922901;36.792198
17145;Дедова Троицкая мужская пустынь;монастырь;кон. XVII в.;нет данных;сохр.;Вологодская обл., Тотемский р-н, хут. Дедов Остров;Мужской монастырь, основанный в кон. XVII в. иноком Ионой. В камне отстроен во 2-й пол. XVIII в. В 1764 упразднен, с 1833 приписан к Спасо-Суморину монастырю. Закрыт в 1920-х, позже большая часть построек разобрана. Сохранились стены настоятельского корпуса (2-я пол. XVIII в.). В 2010 на месте пустыни поставлен крест, в 2011 - часовня.;;59.901460;42.716924
17148;Часовня Троицы Живоначальной на Дедовом острове;часовня;2011;нет данных;действ.;Вологодская обл., Тотемский р-н, хут. Дедов Остров;Небольшая деревянная часовня, квадратная в плане, завершенная главкой на четырехскатной кровле. Сооружена в 2011 у места, где стоял храм Дедовой пустыни, крест на купол установлен 23.09.2011.;Троицы Живоначальной;;
12800;Церковь Антония и Феодосия Киево-Печерских в Дементьево;церковь;;нет данных;сохр.;Вологодская обл., Череповецкий р-н, д. Дементьево;Кирпичная церковь (вероятно, зимняя), построенная в 1850. Прямоугольное в плане здание с декором в духе позднего классицизма. Закрыта не позже 1930-х, венчания сломаны.;Антония и Феодосия Киево-Печерских;;
12799;Церковь Покрова Пресвятой Богородицы в Дементьево;церковь;;нет данных;сохр.;Вологодская обл., Череповецкий р-н, д. Дементьево;Кирпичная церковь с колокольней, построенная в 1816 при помощи П. Голохвастова. Закрыта не позже 1930-х, до настоящего времени уцелели руины здания - алтарная апсида и фрагменты стен.;Покрова Пресвятой Богородицы;;
16795;Церковь Преображения Господня в Демьяново;церковь;;нет данных;сохр.;Вологодская обл., Грязовецкий р-н, д. Демьяново;Кирпичная трёхпрестольная одноглавая церковь, построена на средства прихожан. Одноглавый восьмерик на четверике, трапезная в одной связи с двухъярусной колокольней. Тёплые приделы: Васильевский (правый) и Флоровский (левый). В советское время закрыта, разорена, сломана колокольня.;"Василия Великого; Флора и Лавра; Преображения Господня";58.890203;41.154601
20496;Церковь Покрова Пресвятой Богородицы в Депо;церковь;2010;нет данных;действ.;Вологодская обл., Вытегорский р-н, пос. Депо;"Деревянная церковь, построенная в 2010-2013 на пожертвования ЗАО ""Белый Ручей"" (директор В. М. Лысанов). Крестообразная в плане постройка под восьмигранным в плане куполом с шатром. Приписана к Сретенской церкви Вытегры.";Покрова Пресвятой Богородицы;60.916393;36.845133
24046;Часовня Иоанна Предтечи в Дёмсино;часовня;2006;нет данных;действ.;Вологодская обл., Шекснинский р-н, д. Дёмсино;"Деревянная кубическая часовня с шатровым завершением на четвериковом основании, установленная рядом со святым источником. Построена в 2006 при поддержке НКО ""Фонд поддержки гражданских инициатив"".";Иоанна Предтечи;59.219075;38.633160
14677;Церковь Успения Пресвятой Богородицы в Дитятьево;церковь;не позже нач. XVII в.;нет данных;сохр.;Вологодская обл., Вологодский р-н, д. Дитятьево;Деревянная трёхпрестольная церковь с каменной колокольней. Приделы: Екатерининский и Ильинский. Была приписана к Верхневологодской Михайло-Архангельской церкви. В советское время закрыта, сломаны завершения, верхние ярусы колокольни. Ныне заброшена, разрушается.;"Успения Пресвятой Богородицы; Илии Пророка; Екатерины Великомученицы";59.284123;39.618008
17203;;;;;;;;;;
5900;;;;;;;;;;
5899;;;;;;;;;;
13616;Церковь Михаила Архангела в Елизарово Раменье;церковь;не позже 1-й пол. XVI в.;нет данных;сохр.;Вологодская обл., Череповецкий у., д. Дмитриевское;"Каменная двухпрестольная церковь с холодным Казанским приделом, построена на средства прихожан вместо прежней Димитриевской церкви, сгоревшей в 1797. Основной объём храма - одноглавый четверик с полуциркульной апсидой; трапезная в связи с колокольней (не сохр.). В советское время закрыта, сломаны завершения и колокольня. Ныне заброшена.";"Михаила Архангела; Иконы Божией Матери Казанская";;
10394;Церковь Троицы Живоначальной в Димитриевском на Югу;церковь;;нет данных;сохр.;Вологодская обл., Череповецкий р-н, с. Дмитриевское, между д. 17 и 19;Каменная церковь с Димитриевским приделом. Построена в 1830-е на средства прихожан и благотворительные пожертвования. Освящена в 1835. В советское время закрыта.;"Троицы Живоначальной; Димитрия Солунского";59.019336;38.355867
